{"$schema":"https://json-schema.org/draft/2020-12/schema","title":"PluginOS Lockfile","type":"object","required":["schema","generated_at","source_versions","provider_count","capability_count","policy_count","graph_sha256"],"properties":{"schema":{"const":"pluginos.lock.v1"},"generated_at":{"type":"string"},"source_versions":{"type":"object"},"provider_count":{"type":"integer","minimum":0},"capability_count":{"type":"integer","minimum":0},"policy_count":{"type":"integer","minimum":0},"graph_sha256":{"type":"string","pattern":"^[a-f0-9]{64}$"}},"additionalProperties":false}
